{
  "Version": 1,
  "ScenarioSlug": "federal-foia-management",
  "SolutionUniqueName": "FederalFOIAManagement",
  "PublisherPrefix": "foia",
  "SourceTagField": "foia_syntheticsourcetag",
  "SourceTag": "federal-foia-synthetic-v1",
  "Choices": {
    "foia_intakechannel": ["Public portal", "Agency portal", "Email", "Mail room", "Staff assisted", "FOIA.gov", "API"],
    "foia_validationstate": ["Pending", "Valid", "Correction required", "Rejected"],
    "foia_requestlifecycle": ["Intake", "Clarification", "Search", "Review", "Redaction", "Approval", "Release", "Closure"],
    "foia_taskstate": ["Draft", "Ready", "Assigned", "In progress", "Blocked", "Submitted", "Completed", "Cancelled"],
    "foia_approvalstate": ["Draft", "Proposed", "Pending independent approval", "Approved", "Rejected", "Returned", "Superseded"],
    "foia_reviewtype": ["Responsiveness", "Segregability", "Legal", "Supervisory", "Final release"],
    "foia_disposition": ["Full grant", "Partial grant", "Full denial", "No records", "Withdrawn", "Duplicate", "Other closure"],
    "foia_feecategory": ["Commercial", "Educational or scientific", "News media", "Other"],
    "foia_clockeventtype": ["Received", "Perfected", "Toll started", "Toll ended", "Extension applied", "Due date recalculated", "Appeal received", "Appeal due date calculated", "Closed", "Correction"],
    "foia_auditaction": ["View sensitive content", "Download", "Export", "Package inclusion", "Approval", "Release", "Permission change", "Configuration change"],
    "foia_adapterstatus": ["Disabled", "Ready", "Running", "Succeeded", "Unavailable", "Failed"],
    "foia_aidisposition": ["Pending human review", "Accepted", "Rejected", "Superseded"],
    "foia_expediteddecision": ["Pending", "Granted", "Denied"],
    "foia_reviewfinding": ["Responsive", "Non-responsive", "Partial exemption", "Approved for release", "Returned for review"],
    "foia_packagestate": ["Draft", "Pending approval", "Approved", "Released", "Rejected", "Returned", "Superseded", "Assembling", "Cancelled"],
    "foia_redactionstate": ["Proposed", "Approved", "Rejected", "Applied"],
    "foia_appealstage": ["Intake", "Validation", "Reconsideration", "Decision", "Response", "Closed"],
    "foia_appealoutcome": ["Affirmed", "Reversed", "Partially affirmed", "Remanded", "Withdrawn", "Other closure"],
    "foia_clocktype": ["Request", "Appeal"]
  },
  "Fields": [
    {"Table":"foia_foiarequest","Source":"foia_intakechannel","Target":"foia_intakechannelchoice","Choice":"foia_intakechannel","Label":"Intake Channel","Aliases":{}},
    {"Table":"foia_foiarequest","Source":"foia_validationstate","Target":"foia_validationstatechoice","Choice":"foia_validationstate","Label":"Validation State","Aliases":{"Perfected":100000001}},
    {"Table":"foia_foiarequest","Source":"foia_lifecyclestage","Target":"foia_lifecyclestagechoice","Choice":"foia_requestlifecycle","Label":"Lifecycle Stage","Aliases":{}},
    {"Table":"foia_foiarequest","Source":"foia_expediteddecision","Target":"foia_expediteddecisionchoice","Choice":"foia_expediteddecision","Label":"Expedited Decision","Aliases":{}},
    {"Table":"foia_foiarequest","Source":"foia_disposition","Target":"foia_dispositionchoice","Choice":"foia_disposition","Label":"Disposition","Aliases":{"Open":null}},
    {"Table":"foia_foiarequest","Source":"foia_feecategory","Target":"foia_feecategorychoice","Choice":"foia_feecategory","Label":"Fee Category","Aliases":{"Educational":100000001}},
    {"Table":"contact","Source":"foia_requesterclassification","Target":"foia_requesterclassificationchoice","Choice":"foia_feecategory","Label":"Requester Classification","Aliases":{"Educational":100000001}},
    {"Table":"foia_searchtask","Source":"foia_status","Target":"foia_statuschoice","Choice":"foia_taskstate","Label":"Task Status","Aliases":{}},
    {"Table":"foia_reviewtask","Source":"foia_status","Target":"foia_statuschoice","Choice":"foia_taskstate","Label":"Task Status","Aliases":{}},
    {"Table":"foia_reviewtask","Source":"foia_reviewtype","Target":"foia_reviewtypechoice","Choice":"foia_reviewtype","Label":"Review Type","Aliases":{}},
    {"Table":"foia_reviewtask","Source":"foia_disposition","Target":"foia_dispositionchoice","Choice":"foia_reviewfinding","Label":"Review Finding","Aliases":{}},
    {"Table":"foia_exemptiondecision","Source":"foia_approvalstate","Target":"foia_approvalstatechoice","Choice":"foia_approvalstate","Label":"Approval State","Aliases":{"Pending Approval":100000002}},
    {"Table":"foia_redactiondecision","Source":"foia_finalstate","Target":"foia_finalstatechoice","Choice":"foia_redactionstate","Label":"Final State","Aliases":{}},
    {"Table":"foia_releasepackage","Source":"foia_approvalstate","Target":"foia_approvalstatechoice","Choice":"foia_packagestate","Label":"Package State","Aliases":{}},
    {"Table":"foia_appeal","Source":"foia_stage","Target":"foia_stagechoice","Choice":"foia_appealstage","Label":"Appeal Stage","Aliases":{"Appeal Intake":100000000,"Reconsideration and Legal Review":100000002,"Appeal Decision":100000003,"Closure":100000005}},
    {"Table":"foia_appeal","Source":"foia_outcome","Target":"foia_outcomechoice","Choice":"foia_appealoutcome","Label":"Appeal Outcome","Aliases":{"Open":null}},
    {"Table":"foia_clockevent","Source":"foia_clocktype","Target":"foia_clocktypechoice","Choice":"foia_clocktype","Label":"Clock Type","Aliases":{}},
    {"Table":"foia_clockevent","Source":"foia_eventtype","Target":"foia_eventtypechoice","Choice":"foia_clockeventtype","Label":"Clock Event Type","Aliases":{"Receipt":100000000,"Appeal Receipt":100000006,"Extension":100000004}},
    {"Table":"foia_auditevent","Source":"foia_eventtype","Target":"foia_eventtypechoice","Choice":"foia_auditaction","Label":"Audit Action","Aliases":{}},
    {"Table":"foia_aiassistancerecord","Source":"foia_operationalstatus","Target":"foia_operationalstatuschoice","Choice":"foia_adapterstatus","Label":"Operational Status","Aliases":{"Completed":100000003}},
    {"Table":"foia_aiassistancerecord","Source":"foia_reviewerdisposition","Target":"foia_reviewerdispositionchoice","Choice":"foia_aidisposition","Label":"Reviewer Disposition","Aliases":{"Pending":100000000}}
  ]
}
